Serial No.,College Name,Info
501,M.S. Ramaiah University of Applied Sciences - [MSRUAS],No data found
502,Swami Rama Himalayan University - [SRHU],No data found
503,Srinivas University,No data found
504,East West College of Engineering - [EWCE],If we came to the point of hostel there is 3 floor building having more than 50 rooms and in each room 3 sharing is there and cart chair and study table will be available for each student separately. The quality of the food is not that much good but quantity does not matter how much we want we can eat there is some restrictions for tiffin. The registration process of hostel will also complete in the college only after paying the fees you have to show that fees receipt and releted documents to the hostel warden and you can stay.
504,East West College of Engineering - [EWCE],The hostel is not that good it is not worth to money. The food they provide is not that good and not able to consume. I stay in hostel and the room is shared by three persons.The hostel fees is levied upto 70000
504,East West College of Engineering - [EWCE],In hostel they will alot three members for each member and the hostel food is not good but the hostel is near to hostel its just 5 mins walkable distance from hostel to college the application form for hostel is available in college
504,East West College of Engineering - [EWCE],The hostel is not good that is expected and the registration process is as same as tuition. The meal they provide is not at all good to consume. The room is shared for 3 and the cleaning is quite Ok. The cleaning staff is there and they does it twice in a week.
504,East West College of Engineering - [EWCE],The hostel fees is 70000 per year and it is near to college it's just 5mins walk distance and inhostel three members are allotted in one single room it is spacious and it got attach bathroom for every single room
505,Global Group of Institutes,I would like to rate hostel 4 out of 5.The hostel has a single room which has 4 beds. the room is big enough for 4 students to live and enjoy hostel life comfortabally . The Mess Food quailty is not so good it need to be improved.
505,Global Group of Institutes,Hostel facility is quite moderate . We have got a 4-tier spacious room with attached washroom with geyser facility. We have got separate almirahs and tables. There's also balcony with each room. Meal quality is good but it's not that appetizing . Menu needs to add more veggies in our diet which is not there. Otherwise everything is good.
505,Global Group of Institutes,"So basically there are 4 students in one room but the room is really big enough for 4 people . We are provided with 2 ceeling fans , one room cooler , two tube light , two power connections , and a balcony , and the almirah , chair table and bed . You have to come with your own kagress and pillow . Mess have really nice menu of food on alternate days with huge variety . Hostels have lift and common washroom areas ,and in winters warm water is provided as per timings , and wifi facilities are also 24×7"
505,Global Group of Institutes,"i would rate 5 out of 5 stars. rooms are quite big enough to share among 4 individuals. we will have separate cots, cupboards,table shelves for us. And also there also single seater facility. Mess food its good when compared with other colleges. Food will be based on the menu that we chose. we can choose veg and non veg foods"
505,Global Group of Institutes,Hostel are good and there management is well and good.But mess food is not up to the mark. Rooms of hostels clean and it has sharing rooms. Maids actually come in about 3-4 times a week. The best thing in hostel is laundry they take our clothes from our hostel. The seats for getting a hostel is not low they have got many hostels for 1st years and can get easily a accommodated.
506,Priyadarshini College of Engineering - [PCE],The faculty is very experience and provides more refers to the students for any problem questions. The hostel facility for girls are very good and which is almost 2 to 3 km from the college which is of 38000 for year.
506,Priyadarshini College of Engineering - [PCE],"Our Hostel P3 was situated 4km farway from our college campus in MIDC area, total 150 students stay in p3 hostel, also we have basketball net, and can also we play cricket. Mess facility was also good. At late night we get special snacks facility like chicken noodles and veg noodles, Maggie, cold drink. Overall food quality was not bad but a bit spicy."
506,Priyadarshini College of Engineering - [PCE],No because i am local but for the other state student will go for the hostel facility all rooms are sharing rooms watchman will be there 24 hours food facility will be provided by the hostel no extra charges for it
506,Priyadarshini College of Engineering - [PCE],MPCT have also both girls and boys hostel inside it's campus. It has 3 girls hostel and 1 boys Hostel. The rooms of this hostel are very good and fully furnished. But the washroom are not clean. As only three washroom are available.
506,Priyadarshini College of Engineering - [PCE],"I did not stay in hostel, but rented a flat with few friends. I believe it is quite easy to get a flat or PG. The average rent should land across 3000 per head. And also you can get good food around 2000 2500 per months cost."
507,Jeppiaar Institute of Technology - [JIT],No Iam not opted for hostel but facilities are ok they will provide 1room for 4 students.average fees per year 10000 rupees.comfortable rooms only no problem with water facilities current issues etc.food facilities are also good.
507,Jeppiaar Institute of Technology - [JIT],"The hostel facilities are exceptional with 24 hours power supply, attached washrooms, spacious rooms and much more. There is a TV hall provided and also a gym and students can refresh their minds with indoor and outdoor games."
507,Jeppiaar Institute of Technology - [JIT],The entire hostel has 24 hour power supply with Wi-Fi connectivity. They have spacious rooms with attached washrooms and also a TV hall for the students to relax. The water supply is filtered by the RO and the food in mess is freshly prepared.
507,Jeppiaar Institute of Technology - [JIT],"Hostel is well built and pretty good infrastructure and the fee is around 65-70k INR per year, this fee includes room rent, wifi, mess and bus and other necessary amenities. Rooms are pretty big and well ventilated to cope with TN?s summers. Bathrooms are cleaned every day. You will get your own closet, study table ,bed etc. The food of hostel mess is good also ."
507,Jeppiaar Institute of Technology - [JIT],"Hostel is pretty decent and the fee is around 70000 per year, this fee includes room rent, wifi, mess and other necessary amenities. One room is shared by three students. Rooms are spacious, well built to get fresh air and ventilation is good to cope with TN heat. You will get your own closet, study table . The food of hostel mess is pretty decent too."
508,Seacom Skills University - [SSU],Hostel has a good condition.there are two boys hostel and 2 ladies hostel.hostel is good for all type of students and fees structure is cheaply low than other days so overall hostel is best for girls and boys
508,Seacom Skills University - [SSU],"Campus Life:They held many types of programs, special aspects for students, clubs and students portal to including their life. Sports annual function and other extracurricular activities offered on campus. We enjoyed it."
508,Seacom Skills University - [SSU],"Campus Life:Annual fest and fresher is held together 1 time in a year. Every books which is necessary for us, is found in the library. Annual sports also held in our campus. On that day, faculty members are also joined in sports"
508,Seacom Skills University - [SSU],Campus Life:The number of annual fest is one ond the name of the fest is ritmo. All books are available in our college library and also available journals. The amenitie of class room is present smart board. We play many sports like tennis and football etc. Yes we have a website to find in Google.
508,Seacom Skills University - [SSU],Campus Life:Fest name is Ritmo meaning rhythm and it is conducted in the month of July or August every year. Sufficient amount of standard books available in our course. Sports and co-curricular activites occurs in particular interval of time .
509,SRM University,Hostel is one of the best and the amenities are very good they are maintained very well and hygine they will clean the rooms for every 2days and 24/7 hot water is provided food is also decent and the menu includes every type of meal and items so that everyone can eat well Hostel registration will be alloted once the admission process is completed we can book the hostel throught the student portal provided by the university. Hostel fee starts from 75000 to 200000 based on the type of room There are pgs in near by villages that will cost around 10000 per month
509,SRM University,"Coming to the hostel section u need to be very quick while booking the hostels because they will get booked in a minute or two..I personally experienced this. And coming to the facilities provided in the hostel,they will provide a dustbin,a wardrobe, bathroom and shower room (if it's a big sharing room).There will be hot water provided 24/7.There will be room service provided.And there are some electrical items which are prohibited like electric heaters, kettles,irons and cooking utensils,etc.And there will be checking in the rooms.If any prohibited items are found.. There will be a fine of 4000 rupees.Coming to the meals..the hostel mess provides good food.There will be a very good menu.They keep chicken 3 times a week and paneer 2 times a week.They will also give snacks in the evening."
509,SRM University,"In the campus, there is hostel facility, which has 2 sharing, 3 sharing, 4 sharing, 5 sharing, AC and non AC rooms. According to the affordability of the student, he can choose the room facility. The mess menu is diverse, including north Indian and south Indian cousines. The quality of food is better than any other college out there. During the college admission, one can also register for accomodation in the campus. If one wants to take accomodation outside the campus, there is availability of rental rroms near the campus, and can reach the campus through College bus or their own transport."
509,SRM University,"Hostels and rooms are also good and we have ac or non ac , 2 sharing , 3 sharing, 4 sharing (bunkers also available), 5 sharing, 8 and 10 sharing too. You can register for hostel in the srudent portal provided after admission. Meals are not so good but okish. And hostels are expensive. Hotwater with shower, bed (without matress) , desk and chair, a wardrobe will be given."
509,SRM University,Hostel rooms are good but the toilets are the best.The prices are a bit high and the food is a little bit bland without spice and all but yeah sometimes it's good sometimes it's bad.The menu items are good suitable for all regions and they keep non veg atleast 3 times a week and the schedule is same for all students.
510,University of Technology - [UOT],"This things i liked about college hotel that it's fee is not too expensive, it is 500 for a per day only. If any student is coming for another district or a state than they can live 5-10 days in exams."
510,University of Technology - [UOT],"The hostel infrastructure is very good. The hostel provides its best amenities like attached bathroom, laundry, healthy food, pure drinking water, 24 hours basic supplies etc. There are separate study area for students where they can spend their academic hours."
510,University of Technology - [UOT],Campus Life:There are different types activities are held in campus like sports and festivals celebration. Students take participation in these activities and there are so many facilities available for these functions as students can play for their university in university games and many others.
510,University of Technology - [UOT],"Campus Life:College is very good for social life we celebrate freshers and farewell parties usually. All students participate in Sports. They conduct football, and cricket matches at a college campus."
510,University of Technology - [UOT],"Campus Life:We have an amazing laboratory, which is well maintained and well equipped and the all the apparatus are in proper working condition and if at all there is any breakage or dysfunction, it would be replaced or repaired immediately."
511,CT University - [CTU],The hostel is nice and clean with 9-5 cleaning personnel Theres is 3 seater room with common washroom 2 seater room with attached and non attatches washroom + With ac or none 1 seater room with washroom with with or none ac The price varies but all start from 50k per semester The meal is veg but if we want non veg we can pay extra 6k for non veg and have seperate mess hall
511,CT University - [CTU],"I didn't avail hostel because my home is near campus but I hear about the hostel facility. They provide 24h wifi, ac, the meal is also good, cultural events for hostel students like hostel league.. different hostels are separate for boys, girls and faculty"
511,CT University - [CTU],"hostel facilities are excellent. rooms are fully ac. every hostel has the bed, study table, chair, Almira. The hostel rooms rent ranges 75k to 85 k.mess food is healthy and tasty.food is served according to the menu chart. food is served on schedule time table.quality of food is fine."
511,CT University - [CTU],Campus Life:There are alot of functions held in every month but my favourite function is star night or freshers party. They were the most rememberable part of my life i enjoyed alot. Library is also huge and had alot of stuff to explore
511,CT University - [CTU],"Campus Life:There are different activities in this university other than academic they have different clubs you can join and take part in different activities like dance, singing, poetry, athletics and many other activities"
512,Malla Reddy College of Engineering for Women - [MRCEW],"for a year I used to stay at the college hostel, so the fee was 75 thousand per year. And the food was great to be honest, there would be even panipuri on every Tuesday and even chicken biryani on Wednesdays. But they won't let the students go out and it Is very strict. We don't have washrooms in our room, it's a floor washroom which is used by the whole floor members. And we didn't have big lockers to keep our stuff But now after I changed the hostel, the food isnt that good but not bad. But we have attached washrooms plus the lockers are very big and the rooms are comfortable and clean everyday. And we have an elevator which can be used anytime we want no matter the time. The fees for a private hostel for month is 6,200"
512,Malla Reddy College of Engineering for Women - [MRCEW],"In the first year I stayed in college hostel , maintainace is very good, hostel is very clean, food is good, the fees I paid is 90000 I rented for apartment,it was very clean ,the rooms are very big,if you want join then apartment is the best option you can rent according to your economic status"
512,Malla Reddy College of Engineering for Women - [MRCEW],One big study table and two chairs 4 lockers 4 beds 2 fans is there 4 beds 4 pillows in one room for 4 members Food is very delicious We book room before 1 month opening of the college I pay the fee year
512,Malla Reddy College of Engineering for Women - [MRCEW],The college has separate hostel for both boys and girls. The hostel facility provides good hostel accommodation for the students. The college provides accommodation to the participants of Short-Term Training Programmes. To cater to this service one Executive Hostel and two numbers of Student Hostels are made functional inside the main campus. The Executive Hostel has 24 numbers of AC and 16 numbers of Non AC rooms which can accommodate 80 numbers of participants.
512,Malla Reddy College of Engineering for Women - [MRCEW],"The hostel is really worth spending money . The infrastructure is really nice and the college provides all the basic amenities to the students . The hostel rooms are well coordinated and ample daylight enters the rooms . The hostel wardens are really cooperative and supportive . The hostel costs around 60,000 - 70,000 per year . The food served is decent as you all know yo can never get "" Ghar ka khana :-) """
513,Adichunchanagiri University - [ACU],Hostel in terms of accomodation and comfort is good. But the food is not up to the mark. Girls hostel has a gym and 2 reading rooms also you have an indoor games room. Its clean and the staff who work here are kind
513,Adichunchanagiri University - [ACU],Accommodation is decent with 3 sharing rooms. Fee structure is economical as mentioned earlier. However our hostel doesn't have a gym which is very troubling. The nearest gym is about 4 km away and transport is a problem. Food is also ok
513,Adichunchanagiri University - [ACU],"Hostel is pretty average, it offers a 3 sharing room, 2 sharing room and single rooms, and the prices vary respectively according to the type of accommodation chosen by the students, the mess food is average."
513,Adichunchanagiri University - [ACU],The hostel room is good but food is not good for 75k .The room is wide 3 person can live in that room without any problems . We're getting free WiFi too .The warden is friendly and rules are ok we can adjust evrything
513,Adichunchanagiri University - [ACU],"Hostels are separate for UG and PG students with separate for girls and boys. The facilities provided in the room are a bed, closet, and separate bathroom for each room. Usually the rooms are 3 sharing. The meals provided in the hostels are not the best but manageable. Breakfast, lunch, snacks and dinner is provided. The fees is 85000 per year"
514,Bhabha University - [BU],The hostel the college also has a good infrastructure and the fees per year of the hostel is around rupees 5000. The hostel provides all the basic necessities to the students and the food provided by the mess is also ok ok.
514,Bhabha University - [BU],Campus Life:There are so much annual fest done in my college there Are always availability of books and journals in my college library and amenities. Of my classrooms are good there are So much sports game done as kabbaddi
514,Bhabha University - [BU],"Campus Life:Campus life is not so diverse here, you will feel not like a college, and you feel like you are studying in a school. the library is also available are interested in studies, and extracurriculars are just okay."
514,Bhabha University - [BU],"The hostel is provided in the sharing of two, three, or four people per room. The rooms are quite spacious and comfortable too. Also, it was furnished well and a bed, table, and other basic amenities are provided. We are also given good mess food here."
514,Bhabha University - [BU],"Campus Life:The gender ratio around 75% males and rest females in the B.Tech program whereas the overall ratio of boys and girls if around 55: 45. We cultural parties, fresher's party every year. College conduct many seminars and workshops to help us further decide our career."
515,Sant Baba Bhag Singh University - [SBBSU],The hostel rooms are average . you are provided with two beds with a roommate and a pillow and mattress and a personal almirah with a single fan . the food quality of mess is also average . water supply is on every floor of hostel . if you go for a pg in the local area you have to pay nearly 3500-4000 rupees for a room.
515,Sant Baba Bhag Singh University - [SBBSU],"Sant Baba Bhag Singh University Campus The library contains over 16,500 published works including books, encyclopedias, reports, journals related to engineering disciplines , management and on Applied Sciences and literature.The Books related to course curricula as well as general topics with the aim to provide at all round personality development of students and channelising their energy towards creative aspects. The library currently subscribes to a number of periodicals related to different fields. The library has a computerized search system to assist students in locating their information sources. Show Less"
515,Sant Baba Bhag Singh University - [SBBSU],"Rooms are filled with facilities like drinking water, chairs tables beds fan /Ac beds and lockers are needs are already been filled as per needs of students. Meal and mess food are good healthy as per need this university offers vegetarian food only hygienic and healthy as per necessary. Hostel registration is done by administration cell and warden sections room there are 5 floors apr hostel at sbbs university. PG and rented rooms are available for students who wish to be outside hostel."
515,Sant Baba Bhag Singh University - [SBBSU],We have a hostel of around 500 to 600 rooms. Rooms are around 10' by 10' and 10'by 12'. Admin provides single fan 2 separate beds study chair and study table with mattresses that are included in hostel fee /AC for extra charges 6000 per sem. Hostel food is not my hygienic as large no. Of students come and go from a single gate. Food isn't much good in quality. Hostel mess must be divided into 2 buildings. Around 5-600 students use the same plates on a running basis. Registration for the hostel is done through the warden. And in admission cell 7000 per semester and 2100 mess charges. Those are paid during the first week of joining. One of the most common problems in sbbsu is that you can't go for pg Or you can't rent a room nearby university. University is generally 5 to 6 km away from the main market. No PG and rooms are available anywhere around.
515,Sant Baba Bhag Singh University - [SBBSU],"Campus Life:To bring students closer and together and to inculcate a feeling of belongingness, students are allowed to organise events and fests. These acts are highly appreciated by the students and also my personal favourite is the Annual Commerce Department Fest."
516,Shivajirao Kadam Group of Colleges,The hostel is Situated inside the campus which Helps students to acces the Labs sports room and other things of college hostel is safe and The food is not that much good the fees is 6000rs per month..
516,Shivajirao Kadam Group of Colleges,There is no hostel facility in our college but when from 10 km away the college there is a small area were we can get a good hostels and room for a student were they can live s good life. According to there need.
516,Shivajirao Kadam Group of Colleges,No Hostel provided near college but it provides good facilities in the main city indore so i rated 7 out of 10 because they provided hostel in very good location which is from 10 km away from college
516,Shivajirao Kadam Group of Colleges,There is no hostel facilities since our college is located at a far place from the city. So student stays in city hostels. There are generally 2 canteens in atc. There is no mess. One canteen is big and another one is small. The quality of food is quite low. Even They are not hygienic properly. We wish there could be more variety of things available in the canteen menu because from three years i have seen same menu.
516,Shivajirao Kadam Group of Colleges,Hostel facilities were too good. Neat and clean rooms were their. Daily the bathrooms are cleaned . You have to share one room with your partner.only 2 males can share room not a girl and a boy because if thi will happen then it may cause some problems. And their is goog food facilities . But nonveg is not givem to students but if you want to eat that type of dishes then you may arrive where ever in indore city with your loving one
517,Rai University - [RU],No data found
518,Shri Krishna University - [SKU],"The hostel is equipped with all essential facilities, to make the stay for students comfortable and homely. A well-maintained, hygienic and well-furnished mess with expert cooks serving students healthy sumptuous food is another attraction of the hostel. The hostel can accommodate about 100 students. The hostels are located within the campus of the school. The surroundings are well maintained with lush green gardens and are surrounded by concrete walls. Round-the-clock security ensures a safe haven for the students."
518,Shri Krishna University - [SKU],Hostel is provided in very good environment Neat and clean rooms Hot water cold water facility Breakfast lunch dinner Available There is very low registration fee and hostel fee is very affordable and satisfied Medical facilities are available for any emergency
518,Shri Krishna University - [SKU],"Campus Life:Campus life is best for the first year. But since college is too far and easy, students prefer not to always go there. About attendance, it's not mandatory to 75%, but you have to show your face whenever they summon you for not coming. Sports are best every year. They have both indoor and outdoor sports materials. The whole University conducts several programs as well as seminars per year. And an introduction in the Auditorium for new students if they went on the first day."
518,Shri Krishna University - [SKU],"Campus Life:The annual functions, farewell held on the end of the year. Any Book is taken from the library should have proper record of the student who took the books. In sports, this university students are very good. There is no bad activities in this University."
